Cites,Authors,Title,Year,Source,Publisher,ArticleURL,CitesURL,GSRank,QueryDate,Type,DOI,ISSN,CitationURL,Volume,Issue,StartPage,EndPage,ECC,CitesPerYear,CitesPerAuthor,AuthorCount,Age,Abstract,FullTextURL,RelatedURL,language
325,"J Kemp, D Livingstone",Putting a Second Life “metaverse” skin on learning management systems,2006.0,Proceedings of the Second Life …,hibgroupbpr.pbworks.com,http://hibgroupbpr.pbworks.com/f/Second+Life.pdf#page=22,"https://scholar.google.com/scholar?cites=16167247673914096875&as_sdt=2005&sciodt=0,5&hl=en",1,2022-02-14 11:32:39,PDF,,,,,,,,325,20.31,163,2,16.0,This paper outlines the advantages and weaknesses of Multi-User Virtual Environments for teaching and explores the possible benefits of integrating them closely with traditional …,http://hibgroupbpr.pbworks.com/f/Second+Life.pdf#page=22,"https://scholar.google.com/scholar?q=related:6_xoBxqaXeAJ:scholar.google.com/&scioq=intitle:metaverse&hl=en&as_sdt=0,5",azerbaijani
133,"JDN Dionisio, WGB III, R Gilbert",3D virtual worlds and the metaverse: Current status and future possibilities,2013.0,ACM Computing Surveys (CSUR),dl.acm.org,https://dl.acm.org/doi/abs/10.1145/2480741.2480751,"https://scholar.google.com/scholar?cites=5989405190770777720&as_sdt=2005&sciodt=0,5&hl=en",2,2022-02-14 11:32:39,,10.1145/2480741.2480751,,,,,,,133,14.78,44,3,9.0,"… to an integrated network of 3D virtual worlds or Metaverse rests on progress in four areas: … a functional Metaverse are described. Factors that support the formation of a viable Metaverse, …",https://dl.acm.org/doi/pdf/10.1145/2480741.2480751,"https://scholar.google.com/scholar?q=related:eN7Fq0mkHlMJ:scholar.google.com/&scioq=intitle:metaverse&hl=en&as_sdt=0,5",english
11,"SV Rehm, L Goel, M Crespi","The metaverse as mediator between technology, trends, and the digital transformation of society and business",2015.0,Journal For Virtual …,jvwr-ojs-utexas-stage.tdl.org,https://jvwr-ojs-utexas-stage.tdl.org/jvwr/index.php/jvwr/article/view/7149,"https://scholar.google.com/scholar?cites=8940041317034600019&as_sdt=2005&sciodt=0,5&hl=en",3,2022-02-14 11:32:39,,,,,,,,,11,1.57,4,3,7.0,"… In particular, we consider the role of a Metaverse, understood … application scenarios through the Metaverse as a mediating … through advances of virtual worlds towards a Metaverse. …",https://jvwr-ojs-utexas-stage.tdl.org/jvwr/index.php/jvwr/article/view/7149/6366,"https://scholar.google.com/scholar?q=related:U6YpIzZoEXwJ:scholar.google.com/&scioq=intitle:metaverse&hl=en&as_sdt=0,5",english
9,M Sparkes,What is a metaverse,2021.0,,Elsevier,https://www.sciencedirect.com/science/article/pii/S0262407921014500,"https://scholar.google.com/scholar?cites=6019486813331031822&as_sdt=2005&sciodt=0,5&hl=en",4,2022-02-14 11:32:39,,,,,,,,,9,9.0,9,1,1.0,"… These events, complete with music and 3D graphics, are an example of Silicon Valley's new favourite buzzword: metaverse. … Perhaps the first attempt to create a real metaverse …",,"https://scholar.google.com/scholar?q=related:Doe-Nl2DiVMJ:scholar.google.com/&scioq=intitle:metaverse&hl=en&as_sdt=0,5",english
141,"P Ludlow, M Wallace",The Second Life Herald: The virtual tabloid that witnessed the dawn of the metaverse,2007.0,,books.google.com,https://books.google.com/books?hl=en&lr=&id=9oDkIq6JLlwC&oi=fnd&pg=PR11&dq=metaverse&ots=DqKMxTun0c&sig=9T_e6wHQXMKFqI-T7Ppgu4PNUgg,"https://scholar.google.com/scholar?cites=1646997380176699383&as_sdt=2005&sciodt=0,5&hl=en",5,2022-02-14 11:32:39,BOOK,,,,,,,,141,9.4,71,2,15.0,"… In 1992, science fiction writer Neal Stephenson imagined"" the Metaverse,"" avirtual space that … He is the editorof leading metaverse blog 3pointD. com, and an author of Second Life: The …",,"https://scholar.google.com/scholar?q=related:919uH2RP2xYJ:scholar.google.com/&scioq=intitle:metaverse&hl=en&as_sdt=0,5",english
244,C Ondrejka,Escaping the gilded cage: User created content and building the metaverse,2004.0,NYL Sch. L. Rev.,HeinOnline,https://heinonline.org/hol-cgi-bin/get_pdf.cgi?handle=hein.journals/nyls49&section=14,"https://scholar.google.com/scholar?cites=2170954292522512589&as_sdt=2005&sciodt=0,5&hl=en",6,2022-02-14 11:32:39,,,,,,,,,244,13.56,244,1,18.0,"… Unfortunately, creating the Metaverse proved to be an extremely difficult technical problem. … to build the Metaverse have left the concept of a broadly appealing Metaverse out of favor …",,"https://scholar.google.com/scholar?q=related:zfBpRW3HIB4J:scholar.google.com/&scioq=intitle:metaverse&hl=en&as_sdt=0,5",english
17,"H Duan, J Li, S Fan, Z Lin, X Wu, W Cai",Metaverse for social good: A university campus prototype,2021.0,Proceedings of the 29th ACM …,dl.acm.org,https://dl.acm.org/doi/abs/10.1145/3474085.3479238,"https://scholar.google.com/scholar?cites=10036070613892547084&as_sdt=2005&sciodt=0,5&hl=en",7,2022-02-14 11:32:39,,10.1145/3474085.3479238,,,,,,,17,17.0,3,6,1.0,"… Then we propose a three-layer metaverse … novel metaverse with a detailed timeline and table of specific attributes. Lastly, we illustrate our implemented blockchain-driven metaverse …",https://dl.acm.org/doi/pdf/10.1145/3474085.3479238,"https://scholar.google.com/scholar?q=related:DELNyQxJR4sJ:scholar.google.com/&scioq=intitle:metaverse&hl=en&as_sdt=0,5",english
14,"LH Lee, T Braud, P Zhou, L Wang, D Xu, Z Lin…","All one needs to know about metaverse: A complete survey on technological singularity, virtual ecosystem, and research agenda",2021.0,arXiv preprint arXiv …,arxiv.org,https://arxiv.org/abs/2110.05352,"https://scholar.google.com/scholar?cites=2143047335646200982&as_sdt=2005&sciodt=0,5&hl=en",8,2022-02-14 11:32:39,,,,,,,,,14,14.0,2,7,1.0,"… ing the metaverse, we view that the metaverse research is still in its infancy. Therefore, additional research efforts should be extended in designing and building the metaverse. Instead …",https://arxiv.org/pdf/2110.05352,"https://scholar.google.com/scholar?q=related:lgQKijKivR0J:scholar.google.com/&scioq=intitle:metaverse&hl=en&as_sdt=0,5",english
63,"M Bourlakis, S Papagiannidis, F Li",Retail spatial evolution: paving the way from traditional to metaverse retailing,2009.0,Electronic Commerce Research,Springer,https://link.springer.com/article/10.1007/s10660-009-9030-8,"https://scholar.google.com/scholar?cites=9707489689320316397&as_sdt=2005&sciodt=0,5&hl=en",9,2022-02-14 11:32:39,,10.1007/s10660-009-9030-8,,,,,,,63,4.85,21,3,13.0,"… retailing, ie from traditional to electronic to metaverse retailing and sheds light on the ways … , e-retailers and metaverse retailers. For the metaverse phenomenon, the authors analyse …","https://scholar.google.com/scholar?output=instlink&q=info:7V20oHDut4YJ:scholar.google.com/&hl=en&as_sdt=0,5&scillfp=16408698513426507178&oi=lle","https://scholar.google.com/scholar?q=related:7V20oHDut4YJ:scholar.google.com/&scioq=intitle:metaverse&hl=en&as_sdt=0,5",english
56,"H Choi, S Kim",A content service deployment plan for metaverse museum exhibitions—Centering on the combination of beacons and HMDs,2017.0,International Journal of Information Management,Elsevier,https://www.sciencedirect.com/science/article/pii/S026840121630175X,"https://scholar.google.com/scholar?cites=3634923603695606467&as_sdt=2005&sciodt=0,5&hl=en",10,2022-02-14 11:32:39,HTML,,,,,,,,56,11.2,28,2,5.0,"… Ultimately, this article presents the exhibition content thus created as Metaverse exhibition content made through an effective combination of augmented reality and a virtual world. …",https://www.sciencedirect.com/science/article/pii/S026840121630175X,"https://scholar.google.com/scholar?q=related:w5r1R8LXcTIJ:scholar.google.com/&scioq=intitle:metaverse&hl=en&as_sdt=0,5",english
8,S Hazan,Musing the metaverse,2010.0,"Heritage in the Digital Era, Multi-Science …",cidoc.mini.icom.museum,https://cidoc.mini.icom.museum/wp-content/uploads/sites/6/2018/12/63_papers.pdf,"https://scholar.google.com/scholar?cites=7875108848479501750&as_sdt=2005&sciodt=0,5&hl=en",11,2022-02-14 11:32:39,PDF,,,,,,,,8,0.67,8,1,12.0,"This paper will look at the ways in which museums and cultural institutions are moving into Second Life. It will explore how the new, and surprisingly not so new social and cultural …",https://cidoc.mini.icom.museum/wp-content/uploads/sites/6/2018/12/63_papers.pdf,"https://scholar.google.com/scholar?q=related:tv0nCcYBSm0J:scholar.google.com/&scioq=intitle:metaverse&hl=en&as_sdt=0,5",english
9,"A Siyaev, GS Jo",Towards aircraft maintenance metaverse using speech interactions with virtual objects in mixed reality,2021.0,Sensors,mdpi.com,https://www.mdpi.com/1034944,"https://scholar.google.com/scholar?cites=18367440137455844637&as_sdt=2005&sciodt=0,5&hl=en",12,2022-02-14 11:32:39,,,,,,,,,9,9.0,5,2,1.0,"Metaverses embedded in our lives create virtual experiences inside of the physical world. Moving towards metaverses in aircraft maintenance, mixed reality (MR) creates enormous …",https://www.mdpi.com/1424-8220/21/6/2066/pdf,"https://scholar.google.com/scholar?q=related:Hb1Oen1B5v4J:scholar.google.com/&scioq=intitle:metaverse&hl=en&as_sdt=0,5",english
4,"M Xu, D Niyato, J Kang, Z Xiong, C Miao…",Wireless Edge-Empowered Metaverse: A Learning-Based Incentive Mechanism for Virtual Reality,2021.0,arXiv preprint arXiv …,arxiv.org,https://arxiv.org/abs/2111.03776,"https://scholar.google.com/scholar?cites=4722182742366966989&as_sdt=2005&sciodt=0,5&hl=en",13,2022-02-14 11:32:39,,,,,,,,,4,4.0,1,6,1.0,"The Metaverse is regarded as the next-generation Internet … in wireless edge-empowered Metaverse can immerse in the … framework for VR services in the Metaverse. First, we propose …",https://arxiv.org/pdf/2111.03776,"https://scholar.google.com/scholar?q=related:zVRDWy-QiEEJ:scholar.google.com/&scioq=intitle:metaverse&hl=en&as_sdt=0,5",english
4,"WC Ng, WYB Lim, JS Ng, Z Xiong, D Niyato…",Unified resource allocation framework for the edge intelligence-enabled metaverse,2021.0,arXiv preprint arXiv …,arxiv.org,https://arxiv.org/abs/2110.14325,"https://scholar.google.com/scholar?cites=13128905196908533879&as_sdt=2005&sciodt=0,5&hl=en",14,2022-02-14 11:32:39,,,,,,,,,4,4.0,1,6,1.0,… proposed 3D English Education Metaverse prototype through the implemented metaverse viewer. The metaverse viewer is built for the users to interact with the metaverse. By using the …,https://arxiv.org/pdf/2110.14325,"https://scholar.google.com/scholar?q=related:d1iDd7c9M7YJ:scholar.google.com/&scioq=intitle:metaverse&hl=en&as_sdt=0,5",english
4,"SM Park, YG Kim","A Metaverse: taxonomy, components, applications, and open challenges",2022.0,IEEE Access,ieeexplore.ieee.org,https://ieeexplore.ieee.org/abstract/document/9667507/,"https://scholar.google.com/scholar?cites=13132827393392696752&as_sdt=2005&sciodt=0,5&hl=en",15,2022-02-14 11:32:39,,,,,,,,,4,4.0,2,2,1.0,"… of Metaverse suitable for the present, different from the previous Metaverse. This paper divides the concepts and essential techniques necessary for realizing the Metaverse into three …",https://ieeexplore.ieee.org/iel7/6287639/9668973/09667507.pdf,"https://scholar.google.com/scholar?q=related:sN2w_-4sQbYJ:scholar.google.com/&scioq=intitle:metaverse&hl=en&as_sdt=0,5",english
2,J Kim,Advertising in the Metaverse: Research Agenda,2021.0,Journal of Interactive Advertising,Taylor & Francis,https://www.tandfonline.com/doi/full/10.1080/15252019.2021.2001273,"https://scholar.google.com/scholar?cites=17003096645703694500&as_sdt=2005&sciodt=0,5&hl=en",16,2022-02-14 11:32:39,HTML,10.1080/15252019.2021.2001273,,,,,,,2,2.0,2,1,1.0,"Metaverse is a term that has been gaining traction in the tech world since 2020. The term metaverse, a threedimensional virtual world inhabited by avatars of real people—and coined …",https://www.tandfonline.com/doi/full/10.1080/15252019.2021.2001273,"https://scholar.google.com/scholar?q=related:pPjNIFAi9-sJ:scholar.google.com/&scioq=intitle:metaverse&hl=en&as_sdt=0,5",english
60,D Terdiman,The entrepreneur's guide to Second Life: Making money in the metaverse,2007.0,,books.google.com,https://books.google.com/books?hl=en&lr=&id=7neRdq6VjvQC&oi=fnd&pg=PA6&dq=metaverse&ots=aXmeGMUB77&sig=WkQdwp-WZ4nt3ugrTZqxXfG-eUA,"https://scholar.google.com/scholar?cites=1629716055836438053&as_sdt=2005&sciodt=0,5&hl=en",17,2022-02-14 11:32:39,BOOK,,,,,,,,60,4.0,60,1,15.0,"Business is booming in Second Life, and many residents are earning big bucks in-world—and so can you. This unique guide walks you through what it takes to launch and run a …",,"https://scholar.google.com/scholar?q=related:Ja7hQB7qnRYJ:scholar.google.com/&scioq=intitle:metaverse&hl=en&as_sdt=0,5",english
3,"Y Han, D Niyato, C Leung, C Miao, DI Kim",A Dynamic Resource Allocation Framework for Synchronizing Metaverse with IoT Service and Data,2021.0,arXiv preprint arXiv …,arxiv.org,https://arxiv.org/abs/2111.00431,"https://scholar.google.com/scholar?cites=6833044711983022789&as_sdt=2005&sciodt=0,5&hl=en",18,2022-02-14 11:32:39,,,,,,,,,3,3.0,1,5,1.0,"… the Metaverse, so that new polices, eg, traffic intervention, could be A/B tested in the Metaverse … The benefits of having digital twins in the Metaverse are obvious, as the Metaverse can …",https://arxiv.org/pdf/2111.00431,"https://scholar.google.com/scholar?q=related:xQIcaPbZ014J:scholar.google.com/&scioq=intitle:metaverse&hl=en&as_sdt=0,5",english
2,"H Ning, H Wang, Y Lin, W Wang, S Dhelim…","A Survey on Metaverse: the State-of-the-art, Technologies, Applications, and Challenges",2021.0,arXiv preprint arXiv …,arxiv.org,https://arxiv.org/abs/2111.09673,"https://scholar.google.com/scholar?cites=6009685512733946404&as_sdt=2005&sciodt=0,5&hl=en",19,2022-02-14 11:32:39,,,,,,,,,2,2.0,0,6,1.0,"… development status of the Metaverse, starting from the definition of the Metaverse, and presents … of the Metaverse. Section 2 introduces the development status of Metaverse. Section 3 …",https://arxiv.org/pdf/2111.09673,"https://scholar.google.com/scholar?q=related:JHJRFiKxZlMJ:scholar.google.com/&scioq=intitle:metaverse&hl=en&as_sdt=0,5",english
26,KJL Nevelsteen,"Virtual world, defined from a technological perspective and applied to video games, mixed reality, and the Metaverse",2018.0,Computer Animation and Virtual Worlds,Wiley Online Library,https://onlinelibrary.wiley.com/doi/abs/10.1002/cav.1752,"https://scholar.google.com/scholar?cites=3048041713397760767&as_sdt=2005&sciodt=0,5&hl=en",20,2022-02-14 11:32:39,,10.1002/cav.1752,,,,,,,26,6.5,26,1,4.0,"… In addition, Spence considers the Metaverse a virtual world, whereas in this article, the Metaverse is considered to be similar to the Internet, in accordance with Dionisio, Burns III, and …",https://onlinelibrary.wiley.com/doi/pdf/10.1002/cav.1752,"https://scholar.google.com/scholar?q=related:_4KlA8rRTCoJ:scholar.google.com/&scioq=intitle:metaverse&hl=en&as_sdt=0,5",english
36,S Sonvilla-Weiss,VISIBLE-Learning to Act in the Metaverse,2008.0,,research.aalto.fi,https://research.aalto.fi/en/publications/invisible-learning-to-act-in-the-metaverse,"https://scholar.google.com/scholar?cites=16236458732680578197&as_sdt=2005&sciodt=0,5&hl=en",21,2022-02-14 11:32:39,BOOK,,,,,,,,36,2.57,36,1,14.0,(IN)VISIBLE - Learning to Act in the Metaverse — Aalto University's research portal … (IN)VISIBLE - Learning to Act in the Metaverse … Fingerprint Dive into the research topics of '(IN)VISIBLE …,,"https://scholar.google.com/scholar?q=related:lQS3YzF9U-EJ:scholar.google.com/&scioq=intitle:metaverse&hl=en&as_sdt=0,5",english
47,"C Jaynes, WB Seales, K Calvert, Z Fei…","The Metaverse: a networked collection of inexpensive, self-configuring, immersive environments",2003.0,Proceedings of the …,dl.acm.org,https://dl.acm.org/doi/abs/10.1145/769953.769967,"https://scholar.google.com/scholar?cites=17909871247044141431&as_sdt=2005&sciodt=0,5&hl=en",22,2022-02-14 11:32:39,,10.1145/769953.769967,,,,,,,47,2.47,9,5,19.0,"… We address these issues in the design of the Metaverse. In particular, the … collaboration between Metaverse portals. Finally, we describe a prototype implementation of the Metaverse. …",https://dl.acm.org/doi/pdf/10.1145/769953.769967,"https://scholar.google.com/scholar?q=related:d2EMNQKljPgJ:scholar.google.com/&scioq=intitle:metaverse&hl=en&as_sdt=0,5",english
1,"A Siyaev, GS Jo",Neuro-Symbolic Speech Understanding in Aircraft Maintenance Metaverse,2021.0,IEEE Access,ieeexplore.ieee.org,https://ieeexplore.ieee.org/abstract/document/9617584/,"https://scholar.google.com/scholar?cites=18010482159810176145&as_sdt=2005&sciodt=0,5&hl=en",23,2022-02-14 11:32:39,,,,,,,,,1,1.0,1,2,1.0,"… This paper proposes the metaverse for aircraft maintenance … control operational flow in the metaverse, which is strictly followed … The proposed Aircraft Maintenance Metaverse is a cheap …",https://ieeexplore.ieee.org/iel7/6287639/9312710/09617584.pdf,"https://scholar.google.com/scholar?q=related:keT-yBkW8vkJ:scholar.google.com/&scioq=intitle:metaverse&hl=en&as_sdt=0,5",azerbaijani
8,"K MacCallum, D Parsons",Teacher perspectives on mobile augmented reality: The potential of metaverse for learning,2019.0,World Conference on Mobile and …,learntechlib.org,https://www.learntechlib.org/p/210597/,"https://scholar.google.com/scholar?cites=14706281407575474323&as_sdt=2005&sciodt=0,5&hl=en",24,2022-02-14 11:32:39,,,,,,,,,8,2.67,4,2,3.0,… Through this activity the participants could explore how Metaverse enabled the integration of virtual objects into experiences (we used virtual objects provided within Metaverse but drew …,https://www.learntechlib.org/p/210597/proceedings_210597.pdf,"https://scholar.google.com/scholar?q=related:k8B34QU1F8wJ:scholar.google.com/&scioq=intitle:metaverse&hl=en&as_sdt=0,5",english
1,"Y Jiang, J Kang, D Niyato, X Ge, Z Xiong…",Reliable Coded Distributed Computing for Metaverse Services: Coalition Formation and Incentive Mechanism Design,2021.0,arXiv preprint arXiv …,arxiv.org,https://arxiv.org/abs/2111.10548,"https://scholar.google.com/scholar?cites=6766146570910890810&as_sdt=2005&sciodt=0,5&hl=en",25,2022-02-14 11:32:39,,,,,,,,,1,1.0,0,6,1.0,"… graphic and audio rendering from metaverse service providers cannot be … metaverse services. Therefore, this paper introduces a reliable collaborative CDC framework for metaverse. In …",https://arxiv.org/pdf/2111.10548,"https://scholar.google.com/scholar?q=related:OvteKXUu5l0J:scholar.google.com/&scioq=intitle:metaverse&hl=en&as_sdt=0,5",english
1,"LH Lee, Z Lin, R Hu, Z Gong, A Kumar, T Li, S Li…",When Creators Meet the Metaverse: A Survey on Computational Arts,2021.0,arXiv preprint arXiv …,arxiv.org,https://arxiv.org/abs/2111.13486,"https://scholar.google.com/scholar?cites=4416948744171693205&as_sdt=2005&sciodt=0,5&hl=en",26,2022-02-14 11:32:39,,,,,,,,,1,1.0,0,8,1.0,"The metaverse, enormous virtual-physical cyberspace, has brought unprecedented opportunities for artists to blend every corner of our physical surroundings with digital creativity. This …",https://arxiv.org/pdf/2111.13486,"https://scholar.google.com/scholar?q=related:lSR2F3snTD0J:scholar.google.com/&scioq=intitle:metaverse&hl=en&as_sdt=0,5",english
6,BK Lee,The Metaverse World and Our Future,2021.0,Review of Korea Contents Association,koreascience.or.kr,https://www.koreascience.or.kr/article/JAKO202119759273785.page,"https://scholar.google.com/scholar?cites=13532807301671904878&as_sdt=2005&sciodt=0,5&hl=en",27,2022-02-14 11:32:39,,,,,,,,,6,6.0,6,1,1.0,"… In this ar ticle, we explore the metaverse world that expresses … zepeto, the most popular metaverse service platf orm in Korea, … This confir ms the impact and appearance of the metaverse …",https://www.koreascience.or.kr/article/JAKO202119759273785.pdf,"https://scholar.google.com/scholar?q=related:bmb3fYowzrsJ:scholar.google.com/&scioq=intitle:metaverse&hl=en&as_sdt=0,5",english
4,JY Lee,A study on metaverse hype for sustainable growth,2021.0,International journal of advanced smart convergence,koreascience.or.kr,https://www.koreascience.or.kr/article/JAKO202128054633800.page,"https://scholar.google.com/scholar?cites=2809429761317578505&as_sdt=2005&sciodt=0,5&hl=en",28,2022-02-14 11:32:39,,,,,,,,,4,4.0,4,1,1.0,"… for ‘메타버스’ or ‘metaverse’ in Korea with the traffic searched for ‘metaverse’ all over the … metaverse-related stocks, metaverse coin (virtual currency), metaverse games, and metaverse …",https://www.koreascience.or.kr/article/JAKO202128054633800.pdf,"https://scholar.google.com/scholar?q=related:Cae-oHsZ_SYJ:scholar.google.com/&scioq=intitle:metaverse&hl=en&as_sdt=0,5",english
14,"B Ryskeldiev, Y Ochiai, M Cohen, J Herder",Distributed metaverse: creating decentralized blockchain-based model for peer-to-peer sharing of virtual spaces for mixed reality applications,2018.0,Proceedings of the 9th …,dl.acm.org,https://dl.acm.org/doi/abs/10.1145/3174910.3174952,"https://scholar.google.com/scholar?cites=9429066932314115395&as_sdt=2005&sciodt=0,5&hl=en",29,2022-02-14 11:32:39,,10.1145/3174910.3174952,,,,,,,14,3.5,4,4,4.0,Mixed reality telepresence is becoming an increasingly popular form of interaction in social and collaborative applications. We are interested in how created virtual spaces can be …,https://dl.acm.org/doi/pdf/10.1145/3174910.3174952,"https://scholar.google.com/scholar?q=related:Qw3352rG2oIJ:scholar.google.com/&scioq=intitle:metaverse&hl=en&as_sdt=0,5",english
2,RK Bolger,Finding Wholes in the Metaverse: Posthuman Mystics as Agents of Evolutionary Contextualization,2021.0,Religions,mdpi.com,https://www.mdpi.com/2077-1444/12/9/768,"https://scholar.google.com/scholar?cites=7459310539632616238&as_sdt=2005&sciodt=0,5&hl=en",30,2022-02-14 11:32:39,,,,,,,,,2,2.0,2,1,1.0,"… might be most closely aligned with the culture of the Metaverse? For reasons I will make clear below, I will engage the Metaverse with the evolutionary wholemaking tools the Christian …",https://www.mdpi.com/2077-1444/12/9/768/pdf,"https://scholar.google.com/scholar?q=related:LiMhKGrLhGcJ:scholar.google.com/&scioq=intitle:metaverse&hl=en&as_sdt=0,5",english
21,"SG Lee, S Trimi, WK Byun, M Kang",Innovation and imitation effects in Metaverse service adoption,2011.0,Service Business,Springer,https://link.springer.com/article/10.1007/s11628-011-0108-8,"https://scholar.google.com/scholar?cites=2874267568150571389&as_sdt=2005&sciodt=0,5&hl=en",31,2022-02-14 11:32:39,,10.1007/s11628-011-0108-8,,,,,,,21,1.91,5,4,11.0,"This study examines the innovation and imitation effects in Metaverse service adoption. “Metaverse services” is a collective term for services such as Augmented reality, Life logging, …",https://www.academia.edu/download/47165418/DF610879d01.pdf,"https://scholar.google.com/scholar?q=related:fWkK7R9z4ycJ:scholar.google.com/&scioq=intitle:metaverse&hl=en&as_sdt=0,5",english
34,C Collins,Looking to the future: Higher education in the Metaverse,2008.0,Educause Review,uh.cu,http://www.uh.cu/static/documents/RDA/Looking%20to%20the%20future.pdf,"https://scholar.google.com/scholar?cites=12060107965565592536&as_sdt=2005&sciodt=0,5&hl=en",32,2022-02-14 11:32:39,PDF,,,,,,,,34,2.43,34,1,14.0,"… Though the current state of the emerging metaverse is far from the seamlessly integrated … metaverse is a complex concept. For the purposes of this article, the definition in the Metaverse …",http://www.uh.cu/static/documents/RDA/Looking%20to%20the%20future.pdf,"https://scholar.google.com/scholar?q=related:2GNlKEwcXqcJ:scholar.google.com/&scioq=intitle:metaverse&hl=en&as_sdt=0,5",english
30,"S Van der Land, A Schouten…",Modeling the metaverse: a theoretical model of effective team collaboration in 3D virtual environments,2011.0,Journal of Virtual Worlds …,learntechlib.org,https://www.learntechlib.org/p/178160/,"https://scholar.google.com/scholar?cites=8513007117487332957&as_sdt=2005&sciodt=0,5&hl=en",33,2022-02-14 11:32:39,,,,,,,,,30,2.73,10,3,11.0,"In this paper, a theoretical model of effective team collaboration in 3D virtual environments is presented. The aim of this model is to enhance our understanding of the capabilities …",https://www.learntechlib.org/p/178160/article_178160.pdf,"https://scholar.google.com/scholar?q=related:XV40mN5GJHYJ:scholar.google.com/&scioq=intitle:metaverse&hl=en&as_sdt=0,5",english
18,"E Gadalla, K Keeling, I Abosag",Metaverse-retail service quality: A future framework for retail service quality in the 3D internet,2013.0,Journal of Marketing …,Taylor & Francis,https://www.tandfonline.com/doi/abs/10.1080/0267257X.2013.835742,"https://scholar.google.com/scholar?cites=6886510625848987682&as_sdt=2005&sciodt=0,5&hl=en",34,2022-02-14 11:32:39,,10.1080/0267257X.2013.835742,,,,,,,18,2.0,6,3,9.0,"… Metaverse environment, the untested application of existing e-service quality models (eg, Parasuraman, Zeithaml, & Malhotra, 2005) to Metaverse … determinants of Metaverse Retailing …",http://eprints.soas.ac.uk/21182/1/Main%20document%20with%20authors%20information%20-V-Service%20Quality-%20Special%20issue.3.pdf,"https://scholar.google.com/scholar?q=related:IpCui-3MkV8J:scholar.google.com/&scioq=intitle:metaverse&hl=en&as_sdt=0,5",english
