Cites,Authors,Title,Year,Source,Publisher,ArticleURL,CitesURL,GSRank,QueryDate,Type,DOI,ISSN,CitationURL,Volume,Issue,StartPage,EndPage,ECC,CitesPerYear,CitesPerAuthor,AuthorCount,Age,Abstract,FullTextURL,RelatedURL,language
0,A MONETA,"Architecture, Heritage, and the Metaverse",2020.0,Traditional Dwellings and Settlements Review,JSTOR,https://www.jstor.org/stable/27074915,,213,2022-02-14 11:32:39,,,,,,,,,0,0.0,0,1,2.0,This article reviews the author’s professional work and academic research as an architect and scenographer in the collective virtual space of Second Life. With the aim of establishing a …,,"https://scholar.google.com/scholar?q=related:MhVAueBjv9cJ:scholar.google.com/&scioq=intitle:metaverse&hl=en&as_sdt=0,5",english
1,"S Kim, H Choi",A Study on History Education Content Development Plan Utilized the Metaverse,2016.0,Proceedings of the Korea Contents Association …,koreascience.or.kr,https://www.koreascience.or.kr/article/CFKO201618459285565.page,"https://scholar.google.com/scholar?cites=13677987600787944401&as_sdt=2005&sciodt=0,5&hl=en",214,2022-02-14 11:32:39,,,,,,,,,1,0.17,1,2,6.0,최근 가상현실을 활용한 문화유산 콘텐츠들이 활성화되고 있다. 그러나 그 대부분은 증강현실 이나 가상현실을 통해 단순 복원정보나 고증정보를 제공하는 데 그치고 있다. 이글에서는 메타…,https://www.koreascience.or.kr/article/CFKO201618459285565.pdf,"https://scholar.google.com/scholar?q=related:0bMp-0D50b0J:scholar.google.com/&scioq=intitle:metaverse&hl=en&as_sdt=0,5",english
0,C Stokel-Walker,Welcome to the metaverse,2022.0,New Scientist,Elsevier,https://www.sciencedirect.com/science/article/pii/S0262407922000185,,215,2022-02-14 11:32:39,,,,,,,,,0,0.0,0,1,1.0,"… The buzz surrounding the metaverse raises many questions. Chief among them are, what exactly is the metaverse, is it really just around the corner and, if so, do we actually …",,,english
0,"W Bang, G Park",Entrepreneurial Marketing in the Era of Multicultural METAVERSE,2021.0,Robotics & AI Ethics,scholar.dkyobobook.co.kr,https://scholar.dkyobobook.co.kr/searchDetail.laf?barcode=4010028682227,,216,2022-02-14 11:32:39,,,,,,,,,0,0.0,0,2,1.0,Purpose: This study aims to inquiry the trend of Entrepreneurial Marketing(EM) from the 1987 advent of EM to 2021. We feature how marketing and entrepreneurship interface has …,,,english
0,"IT Jung, BJ Jang",A Study on the Local Particulate Matter Monitoring Technology using Shared-Use Mobilities for Metaverse Reality,2021.0,Journal of Korea Multimedia Society,koreascience.or.kr,https://www.koreascience.or.kr/article/JAKO202125761190585.page,,217,2022-02-14 11:32:39,,,,,,,,,0,0.0,0,2,1.0,"In this study, we developed a'shared-use mobility'-mounted local particulate matter monitoring terminal technology to measure the actual particulate matter concentration around me. As …",https://www.koreascience.or.kr/article/JAKO202125761190585.pdf,"https://scholar.google.com/scholar?q=related:0Sfr4Oh1dOQJ:scholar.google.com/&scioq=intitle:metaverse&hl=en&as_sdt=0,5",english
1,"E Schlemmer, D Trein, H Soares",Digital-Virtual Living Space (ECODI) RICESU: A Net Experience with Second Life Metaverse Technology,2009.0,SLACTIONS 2009,repositorium.sdum.uminho.pt,https://repositorium.sdum.uminho.pt/bitstream/1822/42136/1/NZ_SLACTIONS%202009.pdf#page=171,"https://scholar.google.com/scholar?cites=9831232207748781557&as_sdt=2005&sciodt=0,5&hl=en",218,2022-02-14 11:32:39,PDF,,,,,,,,1,0.08,0,3,13.0,"… To develop the project it was used the Second Life Metaverse-SL, in which it was earlier … two education processes in Metaverse SL and discusses ECODI-RICESU setting up. …",https://repositorium.sdum.uminho.pt/bitstream/1822/42136/1/NZ_SLACTIONS%202009.pdf#page=171,"https://scholar.google.com/scholar?q=related:9dU-15qNb4gJ:scholar.google.com/&scioq=intitle:metaverse&hl=en&as_sdt=0,5",english
0,T Ai,Metaverse Theory,2021.0,Available at SSRN 3840764,papers.ssrn.com,https://papers.ssrn.com/sol3/papers.cfm?abstract_id=3840764,,219,2022-02-14 11:32:39,,,,,,,,,0,0.0,0,1,1.0,"… the metaverse and traditional MMORPG games and real world, then put forward three theorems that the metaverse … it is a game or a world, it has the conditions to become a metaverse. …",,"https://scholar.google.com/scholar?q=related:t6TeAdCpojUJ:scholar.google.com/&scioq=intitle:metaverse&hl=en&as_sdt=0,5",arabic
1,"E Dai, J Bal",Harmonising culture in co-operative business ventures: using a simulation in a metaverse,2009.0,Proceedings of the 3rd European Conference …,alaso.lnx.warwick.ac.uk,http://alaso.lnx.warwick.ac.uk/id/eprint/5309,"https://scholar.google.com/scholar?cites=17311000878063868014&as_sdt=2005&sciodt=0,5&hl=en",220,2022-02-14 11:32:39,,,,,,,,,1,0.08,1,2,13.0,"In recent years, there has been and continues be an increasing numbers of company mergers and takeovers. However, many of them such as the AOL - Time Warner, merger destroy …",,"https://scholar.google.com/scholar?q=related:bth4u5QHPfAJ:scholar.google.com/&scioq=intitle:metaverse&hl=en&as_sdt=0,5",azerbaijani
0,"SW Song, D Chung",Examining the Role of Emoji and Gender during Job Interview Training within Metaverse,2021.0,한국게임학회 논문지,dbpia.co.kr,https://www.dbpia.co.kr/Journal/articleDetail?nodeId=NODE10894025,,221,2022-02-14 11:32:39,,,,,,,,,0,0.0,0,2,1.0,"… system using metaverse, focusing on testing how the design characteristics of a metaverse can … The awareness of the other intelligent being within metaverse in the current study is …",,"https://scholar.google.com/scholar?q=related:1mnah5oNp7YJ:scholar.google.com/&scioq=intitle:metaverse&hl=en&as_sdt=0,5",english
0,M Bridger,Externalities of the Metaverse Gaze,2020.0,,academia.edu,https://www.academia.edu/download/65624638/Externalities_of_the_Metaverse_Gaze.pdf,,222,2022-02-14 11:32:39,PDF,,,,,,,,0,0.0,0,1,2.0,"… The metaverse is a catchall term encapsulating the confluence of our virtual, digital, and physical existences. As realities collide to become the metaverse… portrait of our metaverse gaze, …",https://www.academia.edu/download/65624638/Externalities_of_the_Metaverse_Gaze.pdf,"https://scholar.google.com/scholar?q=related:ewMro-K3wQcJ:scholar.google.com/&scioq=intitle:metaverse&hl=en&as_sdt=0,5",english
1,"M Zyda, R Gehorsam, P Rosedale, M Mine…",Does the metaverse start now?,2003.0,Proceedings of the …,dl.acm.org,https://dl.acm.org/doi/pdf/10.1145/641480.641521,"https://scholar.google.com/scholar?cites=12777301790545108316&as_sdt=2005&sciodt=0,5&hl=en",223,2022-02-14 11:32:39,PDF,10.1145/641480.641521,,,,,,,1,0.05,0,5,19.0,"“The Deliverator belongs to an elite order, a hallowed subcategory. He’s got esprit up to here. Right now, he is preparing to carry out his third mission of the night. His uniform is black as …",https://dl.acm.org/doi/pdf/10.1145/641480.641521,"https://scholar.google.com/scholar?q=related:XF1nDUgYUrEJ:scholar.google.com/&scioq=intitle:metaverse&hl=en&as_sdt=0,5",english
1,"DM Barry, H Kanematsu, Y Fukumura…",W-14 Problem Based Learning Experiences in Metaverse and the Differences between Students in the US and Japan (International Session-II),2009.0,… 2009 JSEE Annual …,jstage.jst.go.jp,https://www.jstage.jst.go.jp/article/jseeen/2009/0/2009_72/_article/-char/ja/,"https://scholar.google.com/scholar?cites=12200839316871926668&as_sdt=2005&sciodt=0,5&hl=en",224,2022-02-14 11:32:39,,,,,,,,,1,0.08,0,4,13.0,"E-Learningcontinues to be used as an educational toolinthe US and Japan. However, thereisstill some debatcabout itseducatienal eff'ectiveness. The reason could be because e-…",https://www.jstage.jst.go.jp/article/jseeen/2009/0/2009_72/_pdf,"https://scholar.google.com/scholar?q=related:jFPFQ7cWUqkJ:scholar.google.com/&scioq=intitle:metaverse&hl=en&as_sdt=0,5",english
1,J Thomason,MetaHealth-How will the Metaverse Change Health Care?,2021.0,Journal of Metaverse,dergipark.org.tr,https://dergipark.org.tr/en/pub/jmv/issue/67581/1051379,"https://scholar.google.com/scholar?cites=7108467721207874887&as_sdt=2005&sciodt=0,5&hl=en",225,2022-02-14 11:32:39,,,,,,,,,1,1.0,1,1,1.0,… Futurists and technologists are also exploring how the Metaverse can play a role in different sectors. This Commentary aims to explore how the Metaverse may be used in the future to …,https://dergipark.org.tr/en/download/article-file/2167692,"https://scholar.google.com/scholar?q=related:RwXt67pZpmIJ:scholar.google.com/&scioq=intitle:metaverse&hl=en&as_sdt=0,5",english
0,HG Kim,NATIONAL R&D INVESTMENT FOR METAVERSE IN SOUTH KOREA,2021.0,한국엔터테인먼트산업학회 학술대회 논문집,dbpia.co.kr,https://www.dbpia.co.kr/Journal/articleDetail?nodeId=NODE10757284,,226,2022-02-14 11:32:39,,,,,,,,,0,0.0,0,1,1.0,"… of expressions on the metaverse and a wide range of … metaverse, and the results were presented in this study so that various researchers could understand the R&D trends in metaverse …",,,english
0,C Kobryn,Architectural Patterns for Metamodeling: The Hitchhiker's Guide to the UML Metaverse,2000.0,International Conference on the Unified Modeling …,Springer,https://link.springer.com/chapter/10.1007/3-540-40011-7_36,,227,2022-02-14 11:32:39,,10.1007/3-540-40011-7_36,,,,,,,0,0.0,0,1,22.0,"Metamodels are playing an increasingly important role in the specification of distributed object and component architectures, such as CORBA, CORBA Component Model, Enterprise …",,,english
1,M Germen,Using 2D photography as a 3D constructional tool within the metaverse,2010.0,Metaverse Creativity (new title: Virtual Creativity),ingentaconnect.com,https://www.ingentaconnect.com/content/intellect/mecr/2010/00000001/00000001/art00004,"https://scholar.google.com/scholar?cites=17242823172988015614&as_sdt=2005&sciodt=0,5&hl=en",228,2022-02-14 11:32:39,,,,,,,,,1,0.08,1,1,12.0,Photography is a powerful 2D representation tool to document 3D volumes like architecture. It is possible to manipulate photos with 2D tools like Photoshop in order to suggest new 3D …,http://research.sabanciuniv.edu/16792/2/Pages_from_MVCR_1.1_Germen-low.pdf,"https://scholar.google.com/scholar?q=related:_hPTxlHQSu8J:scholar.google.com/&scioq=intitle:metaverse&hl=en&as_sdt=0,5",english
1,G Lynch,A Metaverse Art Rresidency:'Garrett Lynch Yoshikaze “Up-in-the-air” Second Life Rresidency',2012.0,Metaverse Creativity (new title: Virtual Creativity),ingentaconnect.com,https://www.ingentaconnect.com/content/intellect/mecr/2012/00000002/00000002/art00004,"https://scholar.google.com/scholar?cites=10974972652085128051&as_sdt=2005&sciodt=0,5&hl=en",229,2022-02-14 11:32:39,,,,,,,,,1,0.1,1,1,10.0,"This article discusses the artist Garrett Lynch’s residency in Second Life®1 at Yoshikaze ‘Up-in-the-air’, HUMLab, Umeå University in Sweden.2 The artist’s mixed-reality live …",,"https://scholar.google.com/scholar?q=related:cyspq3rvTpgJ:scholar.google.com/&scioq=intitle:metaverse&hl=en&as_sdt=0,5",english
0,"SH Han, EJ Kim",Implementation of 2.5 D Metaverse Game Engine Using Java,2006.0,… of the Korean Information Science Society …,koreascience.or.kr,https://www.koreascience.or.kr/article/CFKO200625121629276.page,,230,2022-02-14 11:32:39,,,,,,,,,0,0.0,0,2,16.0,자바의 특징 중 코드 재사용성을 강조하여 게임 엔진에서의 코드 재사용과 확장성을 고려한 비행기 전투 게임인 메타버스 게임 엔진을 개발한다. 현재 PC 게임 개발은 C/C++ 과 DirectX 를 …,https://www.koreascience.or.kr/article/CFKO200625121629276.pdf,,english
0,"SM Yun, CS Leem",An Industry-Service Classification Development of Metaverse Platform,2021.0,Proceedings of the Korean Institute of …,koreascience.or.kr,https://www.koreascience.or.kr/article/CFKO202132348546244.page,,231,2022-02-14 11:32:39,,,,,,,,,0,0.0,0,2,1.0,… for Metaverse by defining Case studies on Metaverse and through … Metaverse this paper propose Metaverse Industry-Service Matrix to analyze the trend and possibility of Metaverse …,https://www.koreascience.or.kr/article/CFKO202132348546244.pdf,"https://scholar.google.com/scholar?q=related:Y5nvU2rbWBsJ:scholar.google.com/&scioq=intitle:metaverse&hl=en&as_sdt=0,5",english
0,J Kim,A Study on the Development of Information Protection Education Contents in the Maritime Using Metaverse,2021.0,Journal of the Korea Institute of Information Security & …,koreascience.or.kr,https://www.koreascience.or.kr/article/JAKO202130865175563.page,,232,2022-02-14 11:32:39,,,,,,,,,0,0.0,0,1,1.0,"Throughout the years, cybersecurity incidents related to the shipbuilding and maritime industries are occurring more frequently as the IT industry develops. Accordingly, expertise in the …",https://www.koreascience.or.kr/article/JAKO202130865175563.pdf,"https://scholar.google.com/scholar?q=related:rijvpqfiN2QJ:scholar.google.com/&scioq=intitle:metaverse&hl=en&as_sdt=0,5",english
0,"Z Fang, L Cai, G Wang",MetaHuman Creator The starting point of the metaverse,2021.0,2021 International Symposium on …,ieeexplore.ieee.org,https://ieeexplore.ieee.org/abstract/document/9603558/,,233,2022-02-14 11:32:39,,,,,,,,,0,0.0,0,3,1.0,"February 11, 2021, Epic Games revealed a first look at MetaHuman Creator, a new browser-based app that will empower anyone to create a bespoke photorealistic digital human, fully …",https://ieeexplore.ieee.org/iel7/9603283/9603419/09603558.pdf,"https://scholar.google.com/scholar?q=related:jrzJIb0FtOQJ:scholar.google.com/&scioq=intitle:metaverse&hl=en&as_sdt=0,5",english
1,L Ripamonti,The Second Life Herald: The virtual tabloid that witnessed the dawn of the metaverse,2010.0,,Taylor & Francis,https://www.tandfonline.com/doi/full/10.1080/13691180903277645,"https://scholar.google.com/scholar?cites=9674515721306635808&as_sdt=2005&sciodt=0,5&hl=en",234,2022-02-14 11:32:39,,10.1080/13691180903277645,,,,,,,1,0.08,1,1,12.0,"The non-case specific chapters include a comparative study of youth participation and perceptions based on survey data, and two essay-style chapters: one on multiple ‘styles’ of …",,"https://scholar.google.com/scholar?q=related:IP5pbsrIQoYJ:scholar.google.com/&scioq=intitle:metaverse&hl=en&as_sdt=0,5",english
0,S Osivand,Investigation of Metaverse in cryptocurrency,2021.0,GSC Advanced Research and Reviews,gsconlinepress.com,https://www.gsconlinepress.com/journals/gscarr/content/investigation-metaverse-cryptocurrency,,235,2022-02-14 11:32:39,,,,,,,,,0,0.0,0,1,1.0,"… for the metaverse, which has recently been receiving a surge in interest, the metaverse will fail to … seven critical topics are relevant to the metaverse, describing novel artworks in blended …",https://www.gsconlinepress.com/journals/gscarr/sites/default/files/GSCARR-2021-0306.pdf,"https://scholar.google.com/scholar?q=related:D5n6kNfxw_AJ:scholar.google.com/&scioq=intitle:metaverse&hl=en&as_sdt=0,5",azerbaijani
1,"S Dominguez-Noriega, JE Agudo…",Language learning resources and developments in the Second Life metaverse,2011.0,International …,inderscienceonline.com,https://www.inderscienceonline.com/doi/abs/10.1504/IJTEL.2011.042101,"https://scholar.google.com/scholar?cites=2392683057333889868&as_sdt=2005&sciodt=0,5&hl=en",236,2022-02-14 11:32:39,,10.1504/IJTEL.2011.042101,,,,,,,1,0.09,0,3,11.0,"Under the auspices of the 3D virtual platform Second Life , our proposal, centred on the learner capacity to act within online environments, consists of applying innovative ideas for …",https://www.researchgate.net/profile/J-Enrique-Agudo/publication/244483455_Language_learning_resources_and_developments_in_the_Second_Life_metaverse/links/5450f1fd0cf201441e9552aa/Language-learning-resources-and-developments-in-the-Second-Life-metaverse.pdf,"https://scholar.google.com/scholar?q=related:TGt7TJCENCEJ:scholar.google.com/&scioq=intitle:metaverse&hl=en&as_sdt=0,5",english
1,M Tadros,E-hijab: Muslim Women in the Metaverse,2010.0,International Journal of Learning and Media,access.portico.org,http://access.portico.org/Portico/show?viewFile=pdf&auId=phx73mtvgcf,"https://scholar.google.com/scholar?cites=11140799061771578390&as_sdt=2005&sciodt=0,5&hl=en",237,2022-02-14 11:32:39,,,,,,,,,1,0.08,1,1,12.0,"… While virtual worlds or augmented realities are not new, they have gained in popularity in recent years thanks to the graphically and artistically creative fantasy worlds of massively …",,"https://scholar.google.com/scholar?q=related:FmzmXrgRnJoJ:scholar.google.com/&scioq=intitle:metaverse&hl=en&as_sdt=0,5",english
0,"Q Feng, R Cai",“Data Hegemony”: Reflections for the Application and Development Direction of Metaverse Technology in Urban Design based on Digital,2021.0,Journal of World Architecture,ojs.bbwpublisher.com,http://ojs.bbwpublisher.com/index.php/JWA/article/view/2780,,238,2022-02-14 11:32:39,,,,,,,,,0,0.0,0,2,1.0,"… Based on the new virtual reality technology “Metaverse,” this paper focuses on the control of … , how the new digital technological “Metaverse” integrates a monopoly on entertainment …",http://ojs.bbwpublisher.com/index.php/JWA/article/view/2780/2503,"https://scholar.google.com/scholar?q=related:fKE9MWALoUkJ:scholar.google.com/&scioq=intitle:metaverse&hl=en&as_sdt=0,5",english
1,"J Bardzell, S Bardzell, W Ryan","Virtual Events in Metaverse Worlds: The Intersection of Interfaces, Leisure, Commerce, and Persistent Groups",,williamryanonline.net,,http://www.williamryanonline.net/publications/jcscw2006.doc,"https://scholar.google.com/scholar?cites=17904699847602227514&as_sdt=2005&sciodt=0,5&hl=en",239,2022-02-14 11:32:39,DOC,,,,,,,,1,0.0,0,3,,"Drawing on aspects of massively multiplayer online games (MMOGs), traditional text-based MUDs, science fiction novels, and real-life commerce and education, among others, …",http://www.williamryanonline.net/publications/jcscw2006.doc,"https://scholar.google.com/scholar?q=related:OklS8qVFevgJ:scholar.google.com/&scioq=intitle:metaverse&hl=en&as_sdt=0,5",english
0,"T Kim, S Hlee",Does Metaverse Improve the Effectiveness of Trade Show?,2021.0,한국경영정보학회 학술대회,earticle.net,https://www.earticle.net/Article/A402825,,240,2022-02-14 11:32:39,,,,,,,,,0,0.0,0,2,1.0,"… satisfaction with metaverse environment (immersion), in detail. To collect data, a virtual metaverse trade show environment is created based on Gather Town, a metaverse platform for …",,,english
1,"D Chodos, E Stroulia",Second Life Gift Registry: Bringing Retail Web Applications into the Metaverse,2008.0,2008 IEEE Congress on Services-Part I,ieeexplore.ieee.org,https://ieeexplore.ieee.org/abstract/document/4578324/,"https://scholar.google.com/scholar?cites=13151103088267808800&as_sdt=2005&sciodt=0,5&hl=en",241,2022-02-14 11:32:39,,,,,,,,,1,0.07,1,2,14.0,"The combination of realistic virtual environments and product information offers a compelling new medium for consumers to shop for products. Specifically, by combining the experience …",https://ieeexplore.ieee.org/iel5/4578272/4578273/04578324.pdf,"https://scholar.google.com/scholar?q=related:INC-zJQagrYJ:scholar.google.com/&scioq=intitle:metaverse&hl=en&as_sdt=0,5",english
0,"MY Openkov, NB Tetenkov",DIGITAL EMPIRES AND THE ANNEXATION OF THE METAVERSE,2021.0,,elibrary.ru,https://elibrary.ru/item.asp?id=47391331,,242,2022-02-14 11:32:39,,,,,,,,,0,0.0,0,2,1.0,"… networking site to a ""metaverse company"" operating on an ""… The metaverse is in the same category. If you take the time to … progress (like the rise of the Metaverse) is inevitable.[3] …",,"https://scholar.google.com/scholar?q=related:iYafPZu5NkkJ:scholar.google.com/&scioq=intitle:metaverse&hl=en&as_sdt=0,5",english
0,"S Kim, E Kim, E Lee, DH Kim",A Study on Metaverse Platform based on 3D-Space Reconstruction,2021.0,… of the Korean Society of Broadcast …,koreascience.or.kr,https://www.koreascience.or.kr/article/CFKO202130759758612.page,,243,2022-02-14 11:32:39,,,,,,,,,0,0.0,0,4,1.0,… 이에 따라 디지털화의 핵심 기술로 Digital twin 과 Metaverse 기술의 중요성이 제고되고 있다. 현재 Metaverse 를 사용한 다양한 기술이 개발되면서 적용 범위가 확대되고 있다. 미래에 …,https://www.koreascience.or.kr/article/CFKO202130759758612.pdf,"https://scholar.google.com/scholar?q=related:yjAIlBFW0_8J:scholar.google.com/&scioq=intitle:metaverse&hl=en&as_sdt=0,5",azerbaijani
0,JY HAN,A Study on the identity of telepresence and interaction of holistic senses in the Metaverse,2021.0,한국컴퓨터게임학회논문지,earticle.net,https://www.earticle.net/Article/A400627,,244,2022-02-14 11:32:39,,,,,,,,,0,0.0,0,1,1.0,"… the Metaverse and discusses the potential of the virtual space as an art therapy space. Recently, the Metaverse … As the contents of emotional communication in the Metaverse have been …",,,english
0,"M da Glória Fraga, D Pedrosa, F Marques, V Loureiro…","Proceedings of the SLACTIONS 2012 research conference on virtual worlds-Life, imagination, and work using metaverse platforms: November 15-17, 2012",2012.0,,academia.edu,https://www.academia.edu/download/42400934/2012SLACTIONSProceedingsFinal.pdf,,245,2022-02-14 11:32:39,PDF,,,,,,,,0,0.0,0,5,10.0,"… METAVERSE PLATAFORMS: NOVEMBER 15-17, … PROCEEDINGS OF THE 4TH INTERNATIONAL RESEARCH CONFERENCE ON VIRTUAL WORLDS–LIFE …",https://www.academia.edu/download/42400934/2012SLACTIONSProceedingsFinal.pdf,,english
0,RA Lee,Is It Possible to Apply the Metaverse to Health Care System?,2022.0,The Ewha Medical Journal,emj.ewhamed.ac.kr,https://emj.ewhamed.ac.kr/journal/download_pdf.php?doi=10.12771/emj.2022.45.1.1,,246,2022-02-14 11:32:39,PDF,10.12771/emj.2022.45.1.1,,,,,,,0,0.0,0,1,1.0,2019 년 12 월 중국 우한에서 발생된 것으로 추정된 코로나바이러스감염증은 2020 년 1 월 전 세계를 강타하면서 사상 초유의 전 세계적 변화를 촉발하였다. 과거 중세시대 2 억 명의 추정…,https://emj.ewhamed.ac.kr/journal/download_pdf.php?doi=10.12771/emj.2022.45.1.1,,english
0,"JD Bolter, M Engberg, B MacIntyre",8 The Myth of Total VR: The Metaverse,2021.0,,ieeexplore.ieee.org,https://ieeexplore.ieee.org/abstract/document/9634077/,,247,2022-02-14 11:32:39,,,,,,,,,0,0.0,0,3,1.0,"Bazin's myth of total cinema was the idea that cinema aspired to be ""a total and complete representation of reality … the reconstruction of a perfect illusion of the outside world in sound, …",,,english
0,"HK Chung, JH Ko",Metaverse Friend Making System Design and Implement,2021.0,Journal of the Semiconductor & Display …,koreascience.or.kr,https://www.koreascience.or.kr/article/JAKO202133649218023.page,,248,2022-02-14 11:32:39,,,,,,,,,0,0.0,0,2,1.0,"… friends among college students in metaverse world. Metaverse technology has recently emerged … to drive the next generation of the Internet, is bringing us closer to the metaverse world. …",https://www.koreascience.or.kr/article/JAKO202133649218023.pdf,"https://scholar.google.com/scholar?q=related:8MSoNnGlR9UJ:scholar.google.com/&scioq=intitle:metaverse&hl=en&as_sdt=0,5",english
0,"오현정, 김정환, 장정헌, 박노일, 이상록","Social Benefits of Living in the Metaverse: The Relationships among Social Presence, Supportive Interaction, Social Self-efficacy, and Feelings of Loneliness",2020.0,한국 PR 학회 학술대회,earticle.net,https://www.earticle.net/Article/A404253,,249,2022-02-14 11:32:39,,,,,,,,,0,0.0,0,5,2.0,"… the two popular metaverse platforms, Roblox … metaverse facilitates supportive interactions among young users, and if their active engagement in supportive interactions in the metaverse …",,,english
0,Oxford Analytica,Metaverse holds unknowable societal risks,2022.0,Emerald Expert Briefings,emerald.com,https://www.emerald.com/insight/content/doi/10.1108/OXAN-DB267012/full/html,,250,2022-02-14 11:32:39,,10.1108/OXAN-DB267012,,,,,,,0,0.0,0,1,1.0,Significance The metaverse -- immersive 3D virtual environments seen as the next disruptive iteration of the internet -- is attracting hype and investment in equal measure. Proto-…,,,arabic
0,SV Popovych,"Business in metaverse, or how we will communicate in the next 5 years",2021.0,,elar.tsatu.edu.ua,http://elar.tsatu.edu.ua/handle/123456789/16120,,251,2022-02-14 11:32:39,,,,,,,,,0,0.0,0,1,1.0,"Even if the idea of Metaverse sounds unreal, all of us still have a number of questions about this whole system. But at the same time, it is obvious, that this will be a new state-of-the-art …",http://elar.tsatu.edu.ua/bitstream/123456789/16120/1/Popovych.pdf,,english
0,Oxford Analytica,Metaverse adoption will multiply cybersecurity risks,2022.0,Emerald Expert Briefings,emerald.com,https://www.emerald.com/insight/content/doi/10.1108/OXAN-GA266968/full/html,,252,2022-02-14 11:32:39,,10.1108/OXAN-GA266968,,,,,,,0,0.0,0,1,1.0,… Infographic exploring the explosion of interest in the concept of the metaverse. But the vulnerability of online environments to criminal and state interference is still a risk that does …,,,english
0,"J Kim, S Oh",Metaverse Based Virtual Reality Space Consulting Service Platform Research and Development,2021.0,Journal of the Semiconductor & Display …,koreascience.or.kr,https://www.koreascience.or.kr/article/JAKO202102455497206.page,,253,2022-02-14 11:32:39,,,,,,,,,0,0.0,0,2,1.0,"… metaverse accelerated due to the spread of the non-face-to-face trend after the COVID-19 pandemic, various metaverse … utilizing the advantages of metaverse. A counseling service …",https://www.koreascience.or.kr/article/JAKO202102455497206.pdf,"https://scholar.google.com/scholar?q=related:tlqKg8D6paMJ:scholar.google.com/&scioq=intitle:metaverse&hl=en&as_sdt=0,5",english
